Theme Name,Keyword,Sentiment,Sentiment Positive %,Sentiment Negative %,Mention Count
Feature Variety & Customisation,Feature Variety & Customisation,positive,99,1,1111
Feature Variety & Customisation,flexible and customizable coverage plans,positive,100,0,250
Feature Variety & Customisation,unlimited annual coverage options,positive,100,0,91
Feature Variety & Customisation,Preventive Care plan add-on,positive,98,2,60
Feature Variety & Customisation,wellness rider included,positive,100,0,54
Feature Variety & Customisation,broad coverage bells and whistles,positive,100,0,52
Feature Variety & Customisation,accident-only plans,positive,100,0,34
Feature Variety & Customisation,multi-pet household suitability and management,positive,100,0,34
Feature Variety & Customisation,no upper age limit,positive,100,0,28
Feature Variety & Customisation,deductible and reimbursement rate choices and comparisons,positive,100,0,26
Feature Variety & Customisation,pet insurance coverage for prescription pet food and savings,positive,100,0,25
Feature Variety & Customisation,wellness add-ons and optional wellness packages,positive,96,4,24
Feature Variety & Customisation,accident-only and accident-and-illness options,positive,100,0,23
Feature Variety & Customisation,comprehensive coverage plans,positive,100,0,16
Feature Variety & Customisation,Gold and Platinum tiered insurance plans,positive,100,0,16
Feature Variety & Customisation,comprehensive pet insurance coverage,positive,100,0,15
Feature Variety & Customisation,plan options for dogs and cats,positive,100,0,15
Feature Variety & Customisation,individualized coverage per pet,positive,93,7,14
Feature Variety & Customisation,customizable pet coverage,positive,100,0,12
Feature Variety & Customisation,wellness add-on tiers,positive,100,0,10
Feature Variety & Customisation,various coverage levels from carriers,positive,100,0,9
Feature Variety & Customisation,pet insurance coverage for spay and neuter procedures,positive,100,0,9
Feature Variety & Customisation,variety of reimbursement options,positive,100,0,9
Feature Variety & Customisation,wellness add-ons with base policy or plan inclusion,positive,89,11,9
Feature Variety & Customisation,high degree of customization,positive,100,0,9
Feature Variety & Customisation,coverage including exam fees and dental illnesses,positive,100,0,7
Feature Variety & Customisation,reimbursement options,positive,86,14,7
Feature Variety & Customisation,pet insurance plans and options overview including Spot Pet Insurance,positive,100,0,7
Feature Variety & Customisation,"deductible options ranging from $100 to $1,000",positive,100,0,7
Feature Variety & Customisation,wellness add-ons with various options and availability,positive,100,0,7
Feature Variety & Customisation,coverage breadth and flexibility,positive,100,0,7
Feature Variety & Customisation,customizable options and fast claims,positive,100,0,7
Feature Variety & Customisation,accident-only and accident-and-illness policies,positive,100,0,7
Feature Variety & Customisation,annual limit options including unlimited choices,positive,100,0,6
Feature Variety & Customisation,range of reimbursement options,positive,100,0,6
Feature Variety & Customisation,wellness add-ons with flexible or customizable plans,positive,100,0,6
Feature Variety & Customisation,Platinum plan comprehensive coverage,positive,100,0,6
Feature Variety & Customisation,unlimited annual payout coverage options,positive,100,0,5
Feature Variety & Customisation,variety of coverage options,positive,100,0,5
Feature Variety & Customisation,"annual coverage limits ranging from $2,500 to unlimited",positive,100,0,5
Feature Variety & Customisation,customization and comprehensive coverage,positive,100,0,4
Feature Variety & Customisation,coverage and benefits tailored for senior dogs,positive,100,0,4
Feature Variety & Customisation,plans and coverage designed for senior pets,positive,100,0,4
Feature Variety & Customisation,pet insurance plans for kittens,positive,100,0,4
Feature Variety & Customisation,wide range of plan caps,positive,100,0,4
Feature Variety & Customisation,wellness add-ons with routine care coverage,positive,100,0,4
Feature Variety & Customisation,solid coverage options,positive,100,0,4
Feature Variety & Customisation,annual coverage limits unlimited,positive,100,0,4
Feature Variety & Customisation,family and shared insurance plans for pets,positive,100,0,4
Feature Variety & Customisation,strong coverage and flexibility,positive,100,0,3
Feature Variety & Customisation,kitten insurance coverage options,positive,100,0,3
Feature Variety & Customisation,multi-pet insurance policy and coverage structure,positive,100,0,3
Feature Variety & Customisation,choose deductible and limits,positive,100,0,3
Feature Variety & Customisation,up to 90% reimbursement options,positive,100,0,3
Feature Variety & Customisation,variety of deductible options,positive,100,0,3
Feature Variety & Customisation,standard accident and illness plans,positive,100,0,3
Feature Variety & Customisation,optional wellness add-on plans with tiered coverage,positive,100,0,3
Feature Variety & Customisation,wellness plan add-ons and wellness add-on plans,positive,100,0,3
Feature Variety & Customisation,coverage and optional add-ons vary,positive,100,0,3
Feature Variety & Customisation,optional wellness and preventive care add-on packages,positive,100,0,2
Feature Variety & Customisation,dental trauma and injury coverage,positive,100,0,2
Feature Variety & Customisation,manage plans separately,positive,100,0,2
Feature Variety & Customisation,preventive care add-ons with 24-hour waiting period,positive,100,0,2
Feature Variety & Customisation,employee benefits programs and plans,positive,100,0,2
Feature Variety & Customisation,Platinum Preventive Care add-on reimbursements,positive,100,0,2
Feature Variety & Customisation,customizable coverage for families,positive,100,0,2
Feature Variety & Customisation,wellness add-ons with reimbursement caps and limits,positive,100,0,2
Feature Variety & Customisation,most customizable policies,positive,100,0,2
Feature Variety & Customisation,wellness plan offerings,positive,100,0,2
Feature Variety & Customisation,comprehensive coverage options for pet insurance plans,positive,100,0,2
Feature Variety & Customisation,coverage for hereditary and congenital conditions,positive,100,0,2
Feature Variety & Customisation,coverage limits and exclusions,positive,100,0,2
Feature Variety & Customisation,pet insurance coverage for unexpected and eligible veterinary expenses,positive,100,0,2
Feature Variety & Customisation,coverage for specific breeds,positive,100,0,2
Feature Variety & Customisation,robust coverage options,positive,100,0,2
Feature Variety & Customisation,wellness coverage in tiers,positive,100,0,2
Feature Variety & Customisation,two-tier optional wellness plan offerings,positive,100,0,2
Feature Variety & Customisation,best for customization,positive,100,0,2
Feature Variety & Customisation,annual limits and deductible combinations with premiums impact,positive,50,50,2
Feature Variety & Customisation,wellness add-ons for accident illness coverage,positive,100,0,2
Feature Variety & Customisation,flexible insurance coverage plans with customizable options,positive,100,0,2
Feature Variety & Customisation,broader perks and useful extras for beginners,positive,100,0,2
Feature Variety & Customisation,coverage options with deductibles,positive,100,0,2
Feature Variety & Customisation,comprehensive coverage plans for senior dogs,positive,100,0,2
Feature Variety & Customisation,accident-only or accident and illness plans,positive,100,0,2
Feature Variety & Customisation,accident-only insurance plan options,positive,100,0,2
Feature Variety & Customisation,deductible options with wide variety,positive,100,0,1
Feature Variety & Customisation,deductible $100 to $750,positive,100,0,1
Feature Variety & Customisation,coverage limits flexibility,positive,100,0,1
Feature Variety & Customisation,customizable insurance plans with broad illness protection,positive,100,0,1
Feature Variety & Customisation,high reimbursement cap,positive,100,0,1
Feature Variety & Customisation,customizing coverage levels,positive,100,0,1
Feature Variety & Customisation,preventive care add-on options,positive,100,0,1
Feature Variety & Customisation,two plan tiers Gold and Platinum,positive,100,0,1
Feature Variety & Customisation,exploring pet insurance options,positive,100,0,1
Feature Variety & Customisation,coverage details and variations by plan and provider,positive,100,0,1
Feature Variety & Customisation,wide range deductible options,positive,100,0,1
Feature Variety & Customisation,wellness add-on plans with reimbursement and benefit caps,positive,100,0,1
Feature Variety & Customisation,also offers 70% and 80% options,positive,100,0,1
Feature Variety & Customisation,no upper age limits for new enrollments,positive,100,0,1
Feature Variety & Customisation,flexible deduction and reimbursement,positive,100,0,1
Feature Variety & Customisation,wellness coverage optionality and cost implications,negative,0,100,1
Feature Variety & Customisation,annual and per-incident deductibles,negative,0,100,1
Core Functionality,Core Functionality,positive,97,3,777
Core Functionality,coverage for curable pre-existing conditions,positive,94,6,86
Core Functionality,"wellness care including exams, vaccinations, and dental cleanings",positive,99,1,76
Core Functionality,24/7 pet telehealth support lines,positive,100,0,70
Core Functionality,coverage including alternative therapies and behavioral issues,positive,100,0,65
Core Functionality,visit any licensed vet in the US and Canada,positive,100,0,60
Core Functionality,coverage for accidents and illnesses,positive,100,0,42
Core Functionality,unrestricted licensed veterinarian usage and access,positive,100,0,35
Core Functionality,waiting and symptom-free periods for coverage eligibility,positive,90,10,29
Core Functionality,reimbursement policies covering vet bills and exam fees,positive,89,11,18
Core Functionality,end-of-life expenses coverage,positive,100,0,18
Core Functionality,pet insurance plans with routine and preventive care coverage,positive,100,0,12
Core Functionality,up to 90% reimbursement,positive,100,0,10
Core Functionality,coverage including exam fees and diagnostic services,positive,100,0,10
Core Functionality,microchipping benefits included,positive,100,0,9
Core Functionality,covers orthopedic conditions like hip dysplasia,positive,56,44,9
Core Functionality,"coverage including genetic, hereditary, and congenital conditions",positive,100,0,8
Core Functionality,most comprehensive coverage plans,positive,100,0,8
Core Functionality,coverage for curable pre-existing conditions after 180 days,positive,100,0,7
Core Functionality,high level of flexibility,positive,100,0,7
Core Functionality,coverage for chronic conditions and ongoing care,positive,100,0,7
Core Functionality,coverage plans including hereditary conditions,positive,100,0,6
Core Functionality,waiting periods requiring 180 symptom-free days for coverage eligibility,positive,100,0,5
Core Functionality,"spaying, neutering, and dental cleaning veterinary services",positive,100,0,5
Core Functionality,reimbursement model standard for pet insurance,positive,75,25,4
Core Functionality,veterinary exam fees and emergency treatment coverage,positive,100,0,4
Core Functionality,no referral or network limitations,positive,100,0,4
Core Functionality,includes hereditary conditions,positive,100,0,4
Core Functionality,annual exams vaccines dental cleaning,positive,100,0,4
Core Functionality,boost employee morale,positive,100,0,4
Core Functionality,freedom to choose specialists,positive,100,0,4
Core Functionality,annual deductible payment and reimbursement processes,positive,100,0,3
Core Functionality,coverage including routine and wellness services,positive,100,0,3
Core Functionality,accident & illness plans,positive,100,0,3
Core Functionality,annual benefit coverage up to $450,positive,100,0,3
Core Functionality,accident-only insurance plans,positive,100,0,3
Core Functionality,comprehensive coverage for illnesses and accidents,positive,100,0,3
Core Functionality,"reimbursement rates of 70%, 80%, or 90% options",positive,100,0,3
Core Functionality,coverage for routine visits and vaccinations,positive,100,0,3
Core Functionality,accepts senior pets,positive,100,0,3
Core Functionality,coverage including behavioral issues and therapies,positive,100,0,3
Core Functionality,coverage for wide range of conditions,positive,100,0,3
Core Functionality,annual limits and reimbursement caps on preventive and wellness services,positive,100,0,2
Core Functionality,annual exams vaccines flea prevention,positive,100,0,2
Core Functionality,wellness coverage explicitly included,positive,100,0,2
Core Functionality,comprehensive plans for young pets,positive,100,0,2
Core Functionality,coverage for genetic and hereditary conditions,positive,100,0,2
Core Functionality,chronic condition and accident support,positive,100,0,2
Core Functionality,Platinum Plan nearly all preventive care,positive,100,0,2
Core Functionality,broader coverage,positive,100,0,2
Core Functionality,annual exams and dental cleanings,positive,100,0,2
Core Functionality,coverage including dental illness and treatments,positive,100,0,2
Core Functionality,"coverage including routine checkups, vaccines, and exams",positive,100,0,2
Core Functionality,dental coverage included,positive,100,0,2
Core Functionality,accident illness preventive care,positive,100,0,2
Core Functionality,"coverage for flea, tick, and heartworm prevention",positive,100,0,2
Core Functionality,broad accident and illness coverage plans,positive,100,0,2
Core Functionality,wellness and telehealth services,positive,100,0,2
Core Functionality,no waiting periods preventive care,positive,100,0,1
Core Functionality,symptom-free waiting periods of 180 days to 365 days for coverage,positive,100,0,1
Core Functionality,"coverage for accidents, illnesses, and chronic conditions",positive,100,0,1
Core Functionality,coverage for hereditary and congenital conditions in insurance plans,positive,100,0,1
Core Functionality,accident-only pet insurance,positive,100,0,1
Core Functionality,variety of discount options,positive,100,0,1
Core Functionality,cost savings and convenience,positive,100,0,1
Core Functionality,checkups vaccines microchipping and preventive care coverage,positive,100,0,1
Core Functionality,direct payment options requiring vet network participation,positive,100,0,1
Core Functionality,coverage for orthopedic and genetic conditions,positive,100,0,1
Core Functionality,coverage for dental illnesses and behavioral issues,positive,100,0,1
Core Functionality,coverage for vaccinations deworming spay neuter wellness exams,positive,100,0,1
Core Functionality,annual exam vaccines tests,positive,100,0,1
Core Functionality,comprehensive dental coverage plans,positive,100,0,1
Core Functionality,individual policies required,positive,100,0,1
Core Functionality,strong accident-only plans,positive,100,0,1
Core Functionality,preventive care and routine dental and vaccination services,positive,100,0,1
Core Functionality,coverage after symptom-free period,positive,100,0,1
Core Functionality,coverage plans with broad coverage and cost control,positive,100,0,1
Core Functionality,wellness exam and basic screening coverage,positive,100,0,1
Core Functionality,solid coverage for dogs,positive,100,0,1
Core Functionality,coverage including behavioral therapy and alternative therapies,positive,100,0,1
Core Functionality,"covers hereditary, genetic, breed-specific conditions",positive,100,0,1
Core Functionality,reimbursement related to paying vet upfront then receiving reimbursement,positive,100,0,1
Core Functionality,routine dental cleanings and flea prevention coverage,positive,100,0,1
Core Functionality,"coverage for injuries, poisoning, and seizures",positive,100,0,1
Core Functionality,coverage including prescription food and behavioral treatment,positive,100,0,1
Core Functionality,less suitable for pets with health issues,positive,100,0,1
Core Functionality,Spot Platinum Plan,positive,100,0,1
Core Functionality,waiting periods for orthopedic and ligament injury coverage,positive,100,0,1
Core Functionality,accidents injuries illnesses emergency care,positive,100,0,1
Core Functionality,accident-only insurance plan coverage focus,positive,100,0,1
Core Functionality,"coverage for flea, tick, and heartworm prevention treatments",positive,100,0,1
Core Functionality,annual exams and vaccines,positive,100,0,1
Core Functionality,coverage for prescription medications in pet insurance,positive,100,0,1
Core Functionality,coverage for senior dogs,positive,100,0,1
Core Functionality,reimbursement amounts and limits,positive,100,0,1
Core Functionality,lacks 100% reimbursement option,positive,100,0,1
Core Functionality,"comprehensive coverage including chronic illnesses, diagnostics, and hereditary conditions",positive,100,0,1
Core Functionality,coverage for dental illness and diseases,positive,100,0,1
Core Functionality,coverage for hereditary conditions with broad or unlimited scope,positive,100,0,1
Core Functionality,coverage only for policy-covered conditions,positive,100,0,1
Core Functionality,no lifetime or per-condition caps,positive,100,0,1
Core Functionality,pre-existing condition exclusions and denials,negative,0,100,2
Core Functionality,breed-specific exclusions and waiting periods,negative,0,100,2
Core Functionality,policy exclusions apply,negative,0,100,1
Core Functionality,no coverage for diabetes arthritis cancer,negative,0,100,1
Core Functionality,no vet-direct pay option,negative,0,100,1
Core Functionality,exclusions for knee and ligament conditions in pet insurance,negative,0,100,1
Core Functionality,common standard exclusions,negative,0,100,1
Core Functionality,policy exclusions and restrictions overview,negative,0,100,1
Promotions & Loyalty Benefits,Promotions & Loyalty Benefits,positive,99,1,380
Promotions & Loyalty Benefits,multi-pet discount programs and savings,positive,100,0,274
Promotions & Loyalty Benefits,discounts and deals on pet essentials and medications,positive,100,0,23
Promotions & Loyalty Benefits,multi-pet discount offerings,positive,100,0,23
Promotions & Loyalty Benefits,10% discount for multiple pets,positive,95,5,22
Promotions & Loyalty Benefits,10% discount on additional pets in multi-pet policies,positive,100,0,8
Promotions & Loyalty Benefits,up to 20% combined or partner discounts,positive,100,0,4
Promotions & Loyalty Benefits,often highest available discount,positive,100,0,4
Promotions & Loyalty Benefits,variety of perks and discounts,positive,100,0,4
Promotions & Loyalty Benefits,multi-pet discount percentages around 10%,positive,100,0,3
Promotions & Loyalty Benefits,cash back and discounts on veterinary care,positive,100,0,2
Promotions & Loyalty Benefits,separate policies with discounts,positive,100,0,2
Promotions & Loyalty Benefits,employee and AAA member pet insurance discounts,positive,100,0,1
Promotions & Loyalty Benefits,10% multi-pet discount applied after the first pet,positive,100,0,1
Promotions & Loyalty Benefits,AAA member discount programs and limitations,positive,100,0,1
Promotions & Loyalty Benefits,variety of discounts,positive,100,0,1
Promotions & Loyalty Benefits,co-branded promotional collateral,positive,100,0,1
Promotions & Loyalty Benefits,discounts for additional pets on multi-pet policies,positive,100,0,1
Promotions & Loyalty Benefits,Spot Perks loyalty program discounts and offers,positive,100,0,1
Promotions & Loyalty Benefits,5-10% multi-pet discount per additional pet,positive,100,0,1
Promotions & Loyalty Benefits,about 10% discount,positive,100,0,1
Promotions & Loyalty Benefits,discount percentages and savings up to 20% on Spot insurance plans,positive,100,0,1
Promotions & Loyalty Benefits,seasonal promotions and special offers on Groupon,positive,100,0,1
Customer Feedback & Ratings,Customer Feedback & Ratings,positive,99,1,227
Customer Feedback & Ratings,top-rated pet insurance companies and providers,positive,100,0,87
Customer Feedback & Ratings,~4.1 rating by Forbes Advisor,positive,100,0,18
Customer Feedback & Ratings,good customer experience,positive,100,0,13
Customer Feedback & Ratings,high customer service ratings and rankings,positive,100,0,10
Customer Feedback & Ratings,positive reputation for Spot Pet Insurance,positive,100,0,9
Customer Feedback & Ratings,highly-rated pet insurance options,positive,100,0,9
Customer Feedback & Ratings,positive user experiences,positive,100,0,8
Customer Feedback & Ratings,highly rated emergency coverage,positive,100,0,7
Customer Feedback & Ratings,customer satisfaction ratings and reviews,positive,100,0,6
Customer Feedback & Ratings,highly rated in 2025,positive,100,0,5
Customer Feedback & Ratings,highly-rated option for cats,positive,100,0,5
Customer Feedback & Ratings,wellness and preventive care add-ons with mixed reviews and concerns,positive,100,0,5
Customer Feedback & Ratings,trusted long-term vet usage,positive,100,0,3
Customer Feedback & Ratings,excellent all-around choice,positive,100,0,3
Customer Feedback & Ratings,best overall provider ratings and recommendations,positive,100,0,3
Customer Feedback & Ratings,shorter waiting periods preferred,positive,100,0,3
Customer Feedback & Ratings,wellness add-ons with strong or highly-rated plans,positive,100,0,3
Customer Feedback & Ratings,recommended options for quote comparison,positive,100,0,2
Customer Feedback & Ratings,top 5 pet insurance companies,positive,100,0,2
Customer Feedback & Ratings,5-star ratings by Wall Street Journal,positive,100,0,2
Customer Feedback & Ratings,frequently recommended well-regarded insurer,positive,100,0,2
Customer Feedback & Ratings,positive employee satisfaction,positive,100,0,2
Customer Feedback & Ratings,rated best for senior pets,positive,100,0,2
Customer Feedback & Ratings,4.27 out of 5 rating scores by MoneyGeek,positive,100,0,1
Customer Feedback & Ratings,positive claim approvals,positive,100,0,1
Customer Feedback & Ratings,claims processing delays and longer processing times,positive,100,0,1
Customer Feedback & Ratings,budget and risk tolerance,positive,100,0,1
Customer Feedback & Ratings,low usage may reduce value,positive,100,0,1
Customer Feedback & Ratings,recommended top providers for pet insurance quotes,positive,100,0,1
Customer Feedback & Ratings,customer experience and satisfaction rankings,positive,100,0,1
Customer Feedback & Ratings,wellness add-on claims and reimbursement issues,positive,100,0,1
Customer Feedback & Ratings,customer satisfaction and emotional value focus,positive,100,0,1
Customer Feedback & Ratings,higher coverage limit increases payment,positive,100,0,1
Customer Feedback & Ratings,recommended for free quotes,positive,100,0,1
Customer Feedback & Ratings,customer experience and marketing reports,positive,100,0,1
Customer Feedback & Ratings,boost morale retention satisfaction,positive,100,0,1
Customer Feedback & Ratings,top-rated pet insurance plans for puppies and kittens,positive,100,0,1
Customer Feedback & Ratings,need to pay veterinary bills upfront,negative,33,67,3
Customer Feedback & Ratings,pet insurance reviews discussion,negative,0,100,1
Price Competitiveness,Price Competitiveness,positive,99,1,143
Price Competitiveness,affordable and budget-friendly pet insurance options,positive,100,0,39
Price Competitiveness,competitive pricing,positive,100,0,12
Price Competitiveness,affordable premiums and clear terms,positive,100,0,8
Price Competitiveness,coverage within or near budget,positive,100,0,7
Price Competitiveness,competitive rates,positive,100,0,7
Price Competitiveness,pet insurance cost comparisons and rate information,positive,100,0,5
Price Competitiveness,monthly premiums in $30-50 range,positive,100,0,5
Price Competitiveness,higher price tier,positive,50,50,4
Price Competitiveness,low $10 monthly cost,positive,100,0,4
Price Competitiveness,competitive affordability for pet insurance,positive,100,0,4
Price Competitiveness,affordable accident-only insurance plans,positive,100,0,3
Price Competitiveness,monthly premium cost variations and impacts,positive,100,0,3
Price Competitiveness,lowest average rates,positive,100,0,2
Price Competitiveness,average monthly premium range $16.94–$34.94,positive,100,0,2
Price Competitiveness,annual payout limit,positive,100,0,2
Price Competitiveness,balance between premium cost and deductible size,positive,100,0,2
Price Competitiveness,reasonable and customary costs,positive,100,0,2
Price Competitiveness,no extra cost service,positive,100,0,2
Price Competitiveness,accident and illness plans from $16,positive,100,0,2
Price Competitiveness,lowest average price,positive,100,0,2
Price Competitiveness,average monthly premium costs around $25,positive,100,0,2
Price Competitiveness,notably lower than national average,positive,100,0,1
Price Competitiveness,higher premiums and premium cost considerations,positive,100,0,1
Price Competitiveness,budget-friendly kitten insurance plans,positive,100,0,1
Price Competitiveness,competitive prices for cat owners,positive,100,0,1
Price Competitiveness,lower reimbursement lower premium,positive,100,0,1
Price Competitiveness,low premiums for cats,positive,100,0,1
Price Competitiveness,pet insurance pricing competitiveness,positive,100,0,1
Price Competitiveness,average monthly cost $12,positive,100,0,1
Price Competitiveness,monthly cost pricing examples,positive,100,0,1
Price Competitiveness,budget-friendly for 3 pets,positive,100,0,1
Price Competitiveness,plans starting around $23 per month,positive,100,0,1
