Theme Name,Keyword,Sentiment,Sentiment Positive %,Sentiment Negative %,Mention Count
Price Competitiveness,very affordable premium options for cats,positive,100,0,1
Price Competitiveness,monthly premiums under $25,positive,100,0,1
Price Competitiveness,average cost $59/month dogs,positive,100,0,1
Price Competitiveness,rates start as low as $15,positive,100,0,1
Price Competitiveness,$35 average monthly for 2 cats,positive,100,0,1
Price Competitiveness,popular dog insurance plans and pricing for 2025,positive,100,0,1
Price Competitiveness,average monthly premium cost around $23 to $29,positive,100,0,1
Price Competitiveness,average rate $57 dogs,positive,100,0,1
Price Competitiveness,higher reimbursement increases premium,positive,100,0,1
Price Competitiveness,annual reimbursement limit restrictions on payouts,positive,100,0,1
Price Competitiveness,wellness add-on cost and pricing comparisons,positive,100,0,1
Price Competitiveness,recognized for competitive pricing,positive,100,0,1
Price Competitiveness,higher monthly premium costs,positive,100,0,1
Speed & Responsiveness,Speed & Responsiveness,positive,100,0,87
Speed & Responsiveness,processes most claims quickly,positive,100,0,38
Speed & Responsiveness,claims resolved in 3-5 days,positive,100,0,17
Speed & Responsiveness,claims processing speed importance,positive,100,0,8
Speed & Responsiveness,claims processing speed,positive,100,0,5
Speed & Responsiveness,rare same-day claim approval,positive,100,0,4
Speed & Responsiveness,claims handled quickly,positive,100,0,4
Speed & Responsiveness,fast direct deposit reimbursement services,positive,100,0,3
Speed & Responsiveness,fast payment methods recommended,positive,100,0,3
Speed & Responsiveness,fast and straightforward pet insurance claims processing,positive,100,0,2
Speed & Responsiveness,fastest claim processing,positive,100,0,1
Speed & Responsiveness,coverage in 24 hours or less,positive,100,0,1
Speed & Responsiveness,transfers funds within 48 hours,positive,100,0,1
Competitive Differentiation,Competitive Differentiation,positive,100,0,73
Competitive Differentiation,no network restrictions,positive,100,0,32
Competitive Differentiation,best pet insurance option,positive,100,0,7
Competitive Differentiation,top provider for wellness coverage,positive,100,0,7
Competitive Differentiation,voluntary pet insurance benefits,positive,100,0,7
Competitive Differentiation,compare pet insurance providers,positive,100,0,4
Competitive Differentiation,top pet insurance benefit program,positive,100,0,4
Competitive Differentiation,highly rated comprehensive coverage options,positive,100,0,2
Competitive Differentiation,better illness and preventive coverage,positive,100,0,1
Competitive Differentiation,leading pet insurance providers and companies,positive,100,0,1
Competitive Differentiation,suitable for group employer offerings,positive,100,0,1
Competitive Differentiation,strong for any age enrollment,positive,100,0,1
Competitive Differentiation,competitors offer shorter terms,positive,100,0,1
Competitive Differentiation,competitor comparison,positive,100,0,1
Competitive Differentiation,helps attract talent,positive,100,0,1
Competitive Differentiation,advantage over other providers,positive,100,0,1
Competitive Differentiation,U.S.-based pet insurance provider,positive,100,0,1
Competitive Differentiation,competitive waiting periods,positive,100,0,1
Ease of Use & Intuitiveness,Ease of Use & Intuitiveness,positive,100,0,68
Ease of Use & Intuitiveness,easy claim process,positive,100,0,35
Ease of Use & Intuitiveness,user-friendly platform,positive,100,0,9
Ease of Use & Intuitiveness,digital claims management via app or online,positive,100,0,5
Ease of Use & Intuitiveness,no provider switching needed,positive,100,0,3
Ease of Use & Intuitiveness,straightforward policies,positive,100,0,2
Ease of Use & Intuitiveness,free customized pet insurance quotes,positive,100,0,2
Ease of Use & Intuitiveness,accident illness plan purchase,positive,100,0,2
Ease of Use & Intuitiveness,easy pet insurance management,positive,100,0,2
Ease of Use & Intuitiveness,direct quote without employer affiliation,positive,100,0,1
Ease of Use & Intuitiveness,digital tool drawbacks,positive,100,0,1
Ease of Use & Intuitiveness,online comparison tools for pet insurance quotes,positive,100,0,1
Ease of Use & Intuitiveness,ease of use for claims,positive,100,0,1
Ease of Use & Intuitiveness,no setup or admin burden,positive,100,0,1
Ease of Use & Intuitiveness,beginner-friendly policies,positive,100,0,1
Ease of Use & Intuitiveness,quick and easy enrollment advantages,positive,100,0,1
Ease of Use & Intuitiveness,easy reimbursement processes,positive,100,0,1
On-boarding & Learning Support,On-boarding & Learning Support,positive,100,0,46
On-boarding & Learning Support,no upper age limit for enrollment in pet insurance,positive,100,0,43
On-boarding & Learning Support,maintain excellent veterinary records,positive,100,0,1
On-boarding & Learning Support,importance of reviewing and understanding pet insurance policy documents,positive,100,0,1
On-boarding & Learning Support,enrollment age starting at 8 weeks for pet insurance,positive,100,0,1
Cost-Effectiveness / ROI,Cost-Effectiveness / ROI,positive,97,3,34
Cost-Effectiveness / ROI,Reimbursement rate up to 90%,positive,100,0,7
Cost-Effectiveness / ROI,balance cost versus coverage,positive,100,0,7
Cost-Effectiveness / ROI,high reimbursement rates,positive,100,0,4
Cost-Effectiveness / ROI,no employer cost or budget impact,positive,100,0,4
Cost-Effectiveness / ROI,cost-effective and affordable pet insurance options,positive,100,0,3
Cost-Effectiveness / ROI,wellness add-ons with positive value and benefits,positive,100,0,2
Cost-Effectiveness / ROI,peace of mind benefits for illnesses and major illnesses,positive,100,0,2
Cost-Effectiveness / ROI,value and flexibility benefits,positive,100,0,2
Cost-Effectiveness / ROI,help offset pet care costs,positive,100,0,1
Cost-Effectiveness / ROI,good add-on value,positive,100,0,1
Cost-Effectiveness / ROI,out of pocket payment,negative,0,100,1
Service Responsivenes,Service Responsivenes,positive,90,10,21
Service Responsivenes,helpful and responsive customer support,positive,100,0,9
Service Responsivenes,reimbursement via direct deposit or check methods,positive,100,0,4
Service Responsivenes,claims and reimbursements processed within 5-7 business days,positive,100,0,1
Service Responsivenes,customer service availability limitations,positive,100,0,1
Service Responsivenes,reimbursement or direct coverage payment options,positive,100,0,1
Service Responsivenes,claims handling focus,positive,100,0,1
Service Responsivenes,claims processed in order received,positive,100,0,1
Service Responsivenes,claims processed within two business days,positive,100,0,1
Service Responsivenes,longer waiting periods,negative,0,100,2
Growth Momentum & Traction,Growth Momentum & Traction,positive,90,10,21
Growth Momentum & Traction,major pet insurance provider,positive,88,12,17
Growth Momentum & Traction,pet insurance providers and companies listings,positive,100,0,2
Growth Momentum & Traction,best pet insurance plans 2025,positive,100,0,1
Growth Momentum & Traction,positive employee retention and satisfaction,positive,100,0,1
Everyday Convenience & Accessibility,Everyday Convenience & Accessibility,positive,93,7,15
Everyday Convenience & Accessibility,manage all policies from one account,positive,100,0,6
Everyday Convenience & Accessibility,pet insurance coverage with vet bills paid upfront,positive,75,25,4
Everyday Convenience & Accessibility,digital convenience and efficiency in processing,positive,100,0,2
Everyday Convenience & Accessibility,account access via mobile app,positive,100,0,1
Everyday Convenience & Accessibility,manage all pets from one account,positive,100,0,1
Everyday Convenience & Accessibility,direct payment ease,positive,100,0,1
Strategic Partnerships & Ecosystem Fit,Strategic Partnerships & Ecosystem Fit,positive,100,0,8
Strategic Partnerships & Ecosystem Fit,partners with employers,positive,100,0,3
Strategic Partnerships & Ecosystem Fit,partnership with Sam’s Club,positive,100,0,2
Strategic Partnerships & Ecosystem Fit,pet insurance workplace benefit programs,positive,100,0,1
Strategic Partnerships & Ecosystem Fit,partnerships and promotions,positive,100,0,1
Strategic Partnerships & Ecosystem Fit,employer partnership and collaboration,positive,100,0,1
Resolution Quality & Self-Help Resources,Resolution Quality & Self-Help Resources,positive,80,20,5
Resolution Quality & Self-Help Resources,claims process metrics,positive,100,0,2
Resolution Quality & Self-Help Resources,coverage limits and cost variability in pet insurance,positive,100,0,1
Resolution Quality & Self-Help Resources,clarity on coverage limits,positive,100,0,1
Resolution Quality & Self-Help Resources,coverage limits specified,negative,0,100,1
Product Road-map & Upgrade Cadence,Product Road-map & Upgrade Cadence,positive,100,0,4
Product Road-map & Upgrade Cadence,wellness coverage in 2025,positive,100,0,3
Product Road-map & Upgrade Cadence,off-cycle launch flexibility,positive,100,0,1
Stock Availability & Supply Reliability,Stock Availability & Supply Reliability,positive,100,0,2
Stock Availability & Supply Reliability,available in all states,positive,100,0,1
Stock Availability & Supply Reliability,availability of accident-only insurance plans,positive,100,0,1